<?xml version="1.0" encoding="UTF-8"?>
<xs:schema xmlns:xs="http://www.w3.org/2001/XMLSchema"
           xmlns="http://www.bikerental.com"
           targetNamespace="http://www.bikerental.com"
           elementFormDefault="qualified">

    <xs:element name="Data">
        <xs:complexType>
            <xs:sequence>
                <xs:element name="bikeRental">
                    <xs:complexType>
                        <xs:sequence>
                            <xs:element name="bike" maxOccurs="unbounded">
                                <xs:complexType>
                                    <xs:sequence>
                                        <xs:element name="name" type="xs:string"/>
                                        <xs:element name="rentalDate" type="xs:date"/>
                                        <xs:element name="returnDate" type="xs:date"/>
                                        <xs:element name="rentalPrice">
                                            <xs:simpleType>
                                                <xs:restriction base="xs:decimal">
                                                    <xs:minInclusive value="0.00"/>
                                                    <xs:fractionDigits value="2"/>
                                                </xs:restriction>
                                            </xs:simpleType>
                                        </xs:element>
                                        <xs:element name="renterName">
                                            <xs:simpleType>
                                                <xs:restriction base="xs:string">
                                                    <xs:minLength value="3"/>
                                                </xs:restriction>
                                            </xs:simpleType>
                                        </xs:element>
                                        <xs:element name="location" type="xs:string"/>
                                    </xs:sequence>
                                    <xs:attribute name="id" type="xs:ID" use="required"/>
                                    <xs:attribute name="type" type="xs:string" use="required"/>
                                </xs:complexType>
                            </xs:element>
                        </xs:sequence>
                    </xs:complexType>
                </xs:element>
                <xs:element name="Rents">
                    <xs:complexType>
                        <xs:sequence>
                            <xs:element name="Bikes" maxOccurs="unbounded">
                                <xs:complexType>
                                    <xs:sequence>
                                        <xs:element name="id" type="xs:int"/>
                                        <xs:element name="name" type="xs:string"/>
                                        <xs:element name="description" type="xs:string"/>
                                        <xs:element name="rent" type="xs:decimal"/>
                                        <xs:element name="stock" type="xs:int"/>
                                    </xs:sequence>
                                </xs:complexType>
                            </xs:element>
                        </xs:sequence>
                    </xs:complexType>
                </xs:element>
            </xs:sequence>
        </xs:complexType>
    </xs:element>
</xs:schema>
